{
  "card_id": "camera_medium_shot_template_001",
  "card_type": "CameraCard",
  "project_id": "project_template_001",
  "owner_role": "Cinematographer / Camera + Lighting Director",
  "status": "draft",
  "version": "1.0.0",
  "required_inputs": {
    "name": "Medium Shot Setup",
    "position": {"x": 0, "y": 1.7, "z": 5},
    "lens_focal_length": 50
  },
  "references": [],
  "constraints": {
    "min_focal_length": 14,
    "max_focal_length": 200
  },
  "allowed_variations": ["static", "pan", "tilt", "dolly"],
  "forbidden_drift": ["cannot_change_position_without_review"],
  "dependencies": [],
  "approval_required_by": "Cinematographer / Camera + Lighting Director",
  "next_action_if_missing": "Create CameraCard to define camera setup",
  "created_at": "2026-01-01T00:00:00Z",
  "updated_at": "2026-01-01T00:00:00Z",
  "name": "Medium Shot Setup",
  "cinematographer": "Cinematographer Name",
  "position": {"x": 0, "y": 1.7, "z": 5},
  "angle": {"pitch": 0, "yaw": 0, "roll": 0},
  "lens_focal_length": 50,
  "depth_of_field": "f/2.8",
  "movement_type": "Static",
  "movement_parameters": {}
}
